{
    "$schema": "http://json-schema.org/draft-04/schema#",
    "$id": "https://raw.githubusercontent.com/ONSdigital/dp-data-pipelines/sandbox/schemas/dataset-ingress/config/v1.json",
    "required_files": [
        {
            "matches": "^data.sdmx$",
            "count": "1"
        }
    ],
    "supplementary_distributions": [
        {
            "matches": "^data.sdmx$",
            "count": "1"
        }
    ],
    "priority": "1",
    "pipeline": "dataset_ingress_v1",
    "options": {
        "transform_identifier": "sdmx.compact.v2.0.prototype.1"
    }
}